{
  "collected_at": "2026-09-29T09:01:50.519312+00:00",
  "items_accepted": 2367,
  "items_seen": 2367,
  "mode": "baseline",
  "run_id": "20260929T090145Z-7a599d4d",
  "schema": "ge16.source-checkpoint.v1",
  "source_id": "news",
  "window_end": "2026-09-29T09:01:50.519312+00:00",
  "window_start": "2026-01-01T00:00:00+00:00"
}
